{
  "criteria": [
    {
      "check_refs": [
        "CHK-P1-TEST",
        "CHK-READY"
      ],
      "checks": [
        {
          "canonical_ref": "PRT-001-task-priority/CHK-P1-TEST",
          "declaration": {
            "availability": "available",
            "canonical_ref": "PRT-001-task-priority/CHK-P1-TEST",
            "command": "test -f apps/api/src/core/service.ts",
            "id": "CHK-P1-TEST",
            "purpose": "Proves the changed task service exists.",
            "run_at": "work"
          },
          "disposition": "not_run",
          "id": "CHK-P1-TEST",
          "result": null
        },
        {
          "canonical_ref": "PRT-001-task-priority/CHK-READY",
          "declaration": {
            "availability": "available",
            "canonical_ref": "PRT-001-task-priority/CHK-READY",
            "command": "test -f apps/api/src/core/service.ts",
            "id": "CHK-READY",
            "purpose": "Confirms the prepared workspace contains the service.",
            "run_at": "readiness"
          },
          "disposition": "not_run",
          "id": "CHK-READY",
          "result": null
        }
      ],
      "criterion_id": "AC-001",
      "declaration": {
        "changed_surfaces": [
          "apps/api/src/core/service.ts"
        ],
        "check_refs": [
          "CHK-P1-TEST",
          "CHK-READY"
        ],
        "cleanup": "No persistent fixture.",
        "criterion_id": "AC-001",
        "environment": "Local tests.",
        "expected_evidence": [
          "Focused test passes."
        ],
        "fixtures": [],
        "gate": "work",
        "path": "Set priority through the task service.",
        "plan_item_ids": [
          "P1"
        ],
        "proof_limits": [
          "No production claim."
        ]
      },
      "gate": "work",
      "protocol_id": "PRT-001-task-priority",
      "statement": "A member changes a task priority."
    }
  ],
  "header": {
    "completeness": "declared",
    "project_id": "PRJ-001-project",
    "role": "output",
    "run_id": "RUN-001-tasks",
    "source_fingerprint": "19b26c18d8f08a965d195a5325205af389807abbde02b054bdf80b2cf8357b14",
    "stage": "plan-review",
    "stage_attempt": "try-001"
  },
  "policy_checks": [],
  "requirements": [
    {
      "id": "R-001",
      "plan_items": [
        {
          "check_refs": [
            "CHK-NEW",
            "CHK-P1-TEST"
          ],
          "id": "P1",
          "work_ids": []
        }
      ],
      "protocol_id": "PRT-001-task-priority",
      "statement": "Priority field."
    }
  ],
  "schema_id": "dd-flow/verification-matrix@1",
  "semantic_assessment": {
    "path": "04-plan-review/decision.json",
    "root": "run",
    "sha256": "492846573f426109bdb030918167f4435992308fed97b2aa06021c338d83d321"
  },
  "sources": [
    {
      "path": "04-plan-review/verification/sources/77bae4b331373b07cdf71acd27acef07229923e245ce5f4534301d2f96f197da/code-work-batch.json",
      "role": "code_work_batch",
      "root": "run",
      "sha256": "77bae4b331373b07cdf71acd27acef07229923e245ce5f4534301d2f96f197da"
    },
    {
      "path": "04-plan-review/verification/sources/aa9dc1e2c172705a8f6ca03141a24a3822ab6de0da4d48fa40e44498befacce7/plan.json",
      "role": "plan:PRT-001-task-priority",
      "root": "run",
      "sha256": "aa9dc1e2c172705a8f6ca03141a24a3822ab6de0da4d48fa40e44498befacce7"
    },
    {
      "path": "02-protocolize/protocolize-result.json",
      "role": "protocolize",
      "root": "run",
      "sha256": "e76aee02e027ca6ca16de8c5b1533e91b469595098e423668cded932ded55ead"
    },
    {
      "path": "02-protocolize/stage-report.json",
      "role": "protocolize_report",
      "root": "run",
      "sha256": "ce5e78f590c3d982d83d6c3d01f65eaa01949de512065e8d55c8271cca6c07f6"
    },
    {
      "path": "04-plan-review/decision.json",
      "role": "semantic_assessment",
      "root": "run",
      "sha256": "492846573f426109bdb030918167f4435992308fed97b2aa06021c338d83d321"
    },
    {
      "path": "01-specify/specify.json",
      "role": "specify",
      "root": "run",
      "sha256": "00ae7c018b7cb7cb7e74c3ddf4c0da94e5fa03bea10248cb34caee01bc01cfaa"
    }
  ]
}
