{
  "criteria": [
    {
      "check_refs": [
        "CHK-P1-TEST",
        "CHK-READY"
      ],
      "checks": [
        {
          "canonical_ref": "PRT-001-task-priority/CHK-P1-TEST",
          "declaration": {
            "availability": "available",
            "canonical_ref": "PRT-001-task-priority/CHK-P1-TEST",
            "command": "test -f apps/api/src/core/service.ts",
            "id": "CHK-P1-TEST",
            "purpose": "Proves the changed task service exists.",
            "run_at": "work"
          },
          "disposition": "retained",
          "id": "CHK-P1-TEST",
          "result": {
            "after_fingerprint": "ac692d28092ca11ae1efaf7811cda45bf6380f989e00e497d688a1eda83526bc",
            "artifacts": [],
            "before_fingerprint": "ac692d28092ca11ae1efaf7811cda45bf6380f989e00e497d688a1eda83526bc",
            "check_refs": [
              "CHK-NEW",
              "CHK-P1-TEST",
              "CHK-READY"
            ],
            "command": "test -f apps/api/src/core/service.ts",
            "completion_path": "05-code/checks/RCP-002/completion.json",
            "declaration_id": "CHK-NEW",
            "exit_code": 0,
            "finished_at": "2026-10-04T00:09:47.180Z",
            "gate": "readiness",
            "id": "RUN-001-tasks/RCP-002",
            "input_hash": "b68d4a5879be27d2b4ed2d71229a5c412c9e421286625f53e50b35d101243aad",
            "inputs": [],
            "local_id": "RCP-002",
            "mutation_paths": [],
            "profile_hash": "b755930d5c66fb967c541429990cc8c66cc949752444d3a5252d471992662c53",
            "receipt_path": "05-code/checks/RCP-002/receipt.json",
            "required_artifacts": [],
            "resources": {
              "ports": {}
            },
            "retry_of_receipt_id": null,
            "retry_reason": null,
            "scope": "aggregate",
            "started_at": "2026-10-04T00:09:47.048Z",
            "status": "passed",
            "stderr_path": "05-code/checks/RCP-002/stderr.log",
            "stdout_path": "05-code/checks/RCP-002/stdout.log",
            "verification_epoch": "aca66db75693e29a827f6c5e9814c93db00a7ddb7c664bd0126aef30d5623210",
            "work_id": null,
            "workspace_fingerprint": "ac692d28092ca11ae1efaf7811cda45bf6380f989e00e497d688a1eda83526bc"
          }
        },
        {
          "canonical_ref": "PRT-001-task-priority/CHK-READY",
          "declaration": {
            "availability": "available",
            "canonical_ref": "PRT-001-task-priority/CHK-READY",
            "command": "test -f apps/api/src/core/service.ts",
            "id": "CHK-READY",
            "purpose": "Confirms the prepared workspace contains the service.",
            "run_at": "readiness"
          },
          "disposition": "retained",
          "id": "CHK-READY",
          "result": {
            "after_fingerprint": "ac692d28092ca11ae1efaf7811cda45bf6380f989e00e497d688a1eda83526bc",
            "artifacts": [],
            "before_fingerprint": "ac692d28092ca11ae1efaf7811cda45bf6380f989e00e497d688a1eda83526bc",
            "check_refs": [
              "CHK-NEW",
              "CHK-P1-TEST",
              "CHK-READY"
            ],
            "command": "test -f apps/api/src/core/service.ts",
            "completion_path": "05-code/checks/RCP-002/completion.json",
            "declaration_id": "CHK-NEW",
            "exit_code": 0,
            "finished_at": "2026-10-04T00:09:47.180Z",
            "gate": "readiness",
            "id": "RUN-001-tasks/RCP-002",
            "input_hash": "b68d4a5879be27d2b4ed2d71229a5c412c9e421286625f53e50b35d101243aad",
            "inputs": [],
            "local_id": "RCP-002",
            "mutation_paths": [],
            "profile_hash": "b755930d5c66fb967c541429990cc8c66cc949752444d3a5252d471992662c53",
            "receipt_path": "05-code/checks/RCP-002/receipt.json",
            "required_artifacts": [],
            "resources": {
              "ports": {}
            },
            "retry_of_receipt_id": null,
            "retry_reason": null,
            "scope": "aggregate",
            "started_at": "2026-10-04T00:09:47.048Z",
            "status": "passed",
            "stderr_path": "05-code/checks/RCP-002/stderr.log",
            "stdout_path": "05-code/checks/RCP-002/stdout.log",
            "verification_epoch": "aca66db75693e29a827f6c5e9814c93db00a7ddb7c664bd0126aef30d5623210",
            "work_id": null,
            "workspace_fingerprint": "ac692d28092ca11ae1efaf7811cda45bf6380f989e00e497d688a1eda83526bc"
          }
        }
      ],
      "criterion_id": "AC-001",
      "declaration": {
        "changed_surfaces": [
          "apps/api/src/core/service.ts"
        ],
        "check_refs": [
          "CHK-P1-TEST",
          "CHK-READY"
        ],
        "cleanup": "No persistent fixture.",
        "criterion_id": "AC-001",
        "environment": "Local tests.",
        "expected_evidence": [
          "Focused test passes."
        ],
        "fixtures": [],
        "gate": "work",
        "path": "Set priority through the task service.",
        "plan_item_ids": [
          "P1"
        ],
        "proof_limits": [
          "No production claim."
        ]
      },
      "gate": "work",
      "protocol_id": "PRT-001-task-priority",
      "statement": "A member changes a task priority."
    }
  ],
  "header": {
    "completeness": "execution",
    "project_id": "PRJ-001-project",
    "role": "output",
    "run_id": "RUN-001-tasks",
    "source_fingerprint": "b28037d0a335fac827b53f81bd5380edc6664b22ddd425fc8f0d325d13bdd329",
    "stage": "code",
    "stage_attempt": "try-001"
  },
  "policy_checks": [],
  "requirements": [
    {
      "id": "R-001",
      "plan_items": [
        {
          "check_refs": [
            "CHK-NEW",
            "CHK-P1-TEST"
          ],
          "id": "P1",
          "work_ids": [
            "WRK-005-prt-001-task-priority-p1"
          ]
        }
      ],
      "protocol_id": "PRT-001-task-priority",
      "statement": "Priority field."
    }
  ],
  "schema_id": "dd-flow/verification-matrix@1",
  "semantic_assessment": {
    "path": "05-code/code-verification.json",
    "root": "run",
    "sha256": "f06a8edc39c7a72e8a2e779f267c306d5da53a18bd3c23c16d8bc90281788c1a"
  },
  "sources": [
    {
      "path": "05-code/verification/sources/77bae4b331373b07cdf71acd27acef07229923e245ce5f4534301d2f96f197da/code-work-batch.json",
      "role": "code_work_batch",
      "root": "run",
      "sha256": "77bae4b331373b07cdf71acd27acef07229923e245ce5f4534301d2f96f197da"
    },
    {
      "path": "05-code/checks/RCP-002/completion.json",
      "role": "completion:PRT-001-task-priority/CHK-NEW",
      "root": "run",
      "sha256": "4ffafeae0f1f85a7e5cada7f1ef254dff9781eebe907becd95e528d242f04634"
    },
    {
      "path": "05-code/checks/RCP-002/completion.json",
      "role": "completion:PRT-001-task-priority/CHK-P1-TEST",
      "root": "run",
      "sha256": "4ffafeae0f1f85a7e5cada7f1ef254dff9781eebe907becd95e528d242f04634"
    },
    {
      "path": "05-code/checks/RCP-002/completion.json",
      "role": "completion:PRT-001-task-priority/CHK-READY",
      "root": "run",
      "sha256": "4ffafeae0f1f85a7e5cada7f1ef254dff9781eebe907becd95e528d242f04634"
    },
    {
      "path": "05-code/verification/sources/aa9dc1e2c172705a8f6ca03141a24a3822ab6de0da4d48fa40e44498befacce7/plan.json",
      "role": "plan:PRT-001-task-priority",
      "root": "run",
      "sha256": "aa9dc1e2c172705a8f6ca03141a24a3822ab6de0da4d48fa40e44498befacce7"
    },
    {
      "path": "02-protocolize/protocolize-result.json",
      "role": "protocolize",
      "root": "run",
      "sha256": "e76aee02e027ca6ca16de8c5b1533e91b469595098e423668cded932ded55ead"
    },
    {
      "path": "02-protocolize/stage-report.json",
      "role": "protocolize_report",
      "root": "run",
      "sha256": "baee44eba5f62c2056e15ce39a27572b729e83b9b113388f9cb1fa999e0b0d69"
    },
    {
      "path": "05-code/checks/RCP-002/receipt.json",
      "role": "receipt:PRT-001-task-priority/CHK-NEW",
      "root": "run",
      "sha256": "18214a873c599a53400ddd5ab358cd88eb12bd62fbc14874ffa8a37abe815306"
    },
    {
      "path": "05-code/checks/RCP-002/receipt.json",
      "role": "receipt:PRT-001-task-priority/CHK-P1-TEST",
      "root": "run",
      "sha256": "18214a873c599a53400ddd5ab358cd88eb12bd62fbc14874ffa8a37abe815306"
    },
    {
      "path": "05-code/checks/RCP-002/receipt.json",
      "role": "receipt:PRT-001-task-priority/CHK-READY",
      "root": "run",
      "sha256": "18214a873c599a53400ddd5ab358cd88eb12bd62fbc14874ffa8a37abe815306"
    },
    {
      "path": "05-code/code-verification.json",
      "role": "semantic_assessment",
      "root": "run",
      "sha256": "f06a8edc39c7a72e8a2e779f267c306d5da53a18bd3c23c16d8bc90281788c1a"
    },
    {
      "path": "01-specify/specify.json",
      "role": "specify",
      "root": "run",
      "sha256": "00ae7c018b7cb7cb7e74c3ddf4c0da94e5fa03bea10248cb34caee01bc01cfaa"
    }
  ]
}
