{
  "criteria": [
    {
      "check_refs": [
        "CHK-P1-TEST",
        "CHK-READY"
      ],
      "checks": [
        {
          "canonical_ref": "PRT-001-task-priority/CHK-P1-TEST",
          "declaration": {
            "availability": "available",
            "canonical_ref": "PRT-001-task-priority/CHK-P1-TEST",
            "command": "test -f apps/api/src/core/service.ts",
            "id": "CHK-P1-TEST",
            "purpose": "Proves the changed task service exists.",
            "run_at": "work"
          },
          "disposition": "not_run",
          "id": "CHK-P1-TEST",
          "result": null
        },
        {
          "canonical_ref": "PRT-001-task-priority/CHK-READY",
          "declaration": {
            "availability": "available",
            "canonical_ref": "PRT-001-task-priority/CHK-READY",
            "command": "test -f apps/api/src/core/service.ts",
            "id": "CHK-READY",
            "purpose": "Confirms the prepared workspace contains the service.",
            "run_at": "readiness"
          },
          "disposition": "not_run",
          "id": "CHK-READY",
          "result": null
        }
      ],
      "criterion_id": "AC-001",
      "declaration": {
        "changed_surfaces": [
          "apps/api/src/core/service.ts"
        ],
        "check_refs": [
          "CHK-P1-TEST",
          "CHK-READY"
        ],
        "cleanup": "No persistent fixture.",
        "criterion_id": "AC-001",
        "environment": "Local tests.",
        "expected_evidence": [
          "Focused test passes."
        ],
        "fixtures": [],
        "gate": "work",
        "path": "Set priority through the task service.",
        "plan_item_ids": [
          "P1"
        ],
        "proof_limits": [
          "No production claim."
        ]
      },
      "gate": "work",
      "protocol_id": "PRT-001-task-priority",
      "statement": "A member changes a task priority."
    }
  ],
  "header": {
    "completeness": "declared",
    "project_id": "PRJ-001-project",
    "role": "output",
    "run_id": "RUN-001-tasks",
    "source_fingerprint": "7b0aeb5bed1436c86617992863bbfc70f7ae88b104707e3a3d23d562d51180c8",
    "stage": "plan",
    "stage_attempt": "try-001"
  },
  "policy_checks": [],
  "requirements": [
    {
      "id": "R-001",
      "plan_items": [
        {
          "check_refs": [
            "CHK-NEW",
            "CHK-P1-TEST"
          ],
          "id": "P1",
          "work_ids": []
        }
      ],
      "protocol_id": "PRT-001-task-priority",
      "statement": "Priority field."
    }
  ],
  "schema_id": "dd-flow/verification-matrix@1",
  "sources": [
    {
      "path": "03-plan/verification/sources/87e04b2d0de72ebc62c60cc3fcf258903579dc55ea1f8925affe328a03b062d9/code-work-batch.json",
      "role": "code_work_batch",
      "root": "run",
      "sha256": "87e04b2d0de72ebc62c60cc3fcf258903579dc55ea1f8925affe328a03b062d9"
    },
    {
      "path": "03-plan/verification/sources/54ab1c31ae295a032639f7764fffbf6f8ff2c7e96a87821a0c89d88bd3bb0387/plan.json",
      "role": "plan:PRT-001-task-priority",
      "root": "run",
      "sha256": "54ab1c31ae295a032639f7764fffbf6f8ff2c7e96a87821a0c89d88bd3bb0387"
    },
    {
      "path": "02-protocolize/protocolize-result.json",
      "role": "protocolize",
      "root": "run",
      "sha256": "e76aee02e027ca6ca16de8c5b1533e91b469595098e423668cded932ded55ead"
    },
    {
      "path": "02-protocolize/stage-report.json",
      "role": "protocolize_report",
      "root": "run",
      "sha256": "5afa9f09586879300783c1b66f690b3822236d062dc7d17430f89013ae67f30b"
    },
    {
      "path": "01-specify/specify.json",
      "role": "specify",
      "root": "run",
      "sha256": "00ae7c018b7cb7cb7e74c3ddf4c0da94e5fa03bea10248cb34caee01bc01cfaa"
    }
  ]
}
